{
  "$schema": "https://json-schema.org/draft/2020-12/schema",
  "type": "object",
  "properties": {
    "schemaVersion": {
      "type": "string",
      "const": "1.0"
    },
    "video": {
      "type": "object",
      "properties": {
        "id": {
          "type": "string",
          "pattern": "^[A-Za-z0-9_-]{11}$"
        },
        "url": {
          "type": "string",
          "format": "uri"
        },
        "title": {
          "type": "string",
          "minLength": 1
        },
        "channel": {
          "type": "string"
        },
        "duration": {
          "type": "object",
          "properties": {
            "seconds": {
              "type": "integer",
              "minimum": 0,
              "maximum": 9007199254740991
            },
            "formatted": {
              "type": "string",
              "pattern": "^\\d{1,2}:\\d{2}:\\d{2}$"
            }
          },
          "required": ["seconds", "formatted"],
          "additionalProperties": false
        }
      },
      "required": ["id", "url", "title"],
      "additionalProperties": false
    },
    "abstract": {
      "type": "string",
      "minLength": 1
    },
    "mainTakeaway": {
      "type": "string",
      "minLength": 1
    },
    "highlights": {
      "minItems": 1,
      "type": "array",
      "items": {
        "type": "object",
        "properties": {
          "time": {
            "type": "string",
            "pattern": "^\\d{2}:\\d{2}:\\d{2}$"
          },
          "seconds": {
            "type": "integer",
            "minimum": 0,
            "maximum": 9007199254740991
          },
          "title": {
            "type": "string",
            "minLength": 1
          },
          "description": {
            "type": "string",
            "minLength": 1
          },
          "emphasis": {
            "type": "array",
            "items": {
              "type": "string"
            }
          }
        },
        "required": ["time", "seconds", "title", "description"],
        "additionalProperties": false
      }
    },
    "sections": {
      "minItems": 1,
      "type": "array",
      "items": {
        "type": "object",
        "properties": {
          "title": {
            "type": "string",
            "minLength": 1
          },
          "points": {
            "minItems": 1,
            "type": "array",
            "items": {
              "type": "object",
              "properties": {
                "time": {
                  "type": "string",
                  "pattern": "^\\d{2}:\\d{2}:\\d{2}$"
                },
                "seconds": {
                  "type": "integer",
                  "minimum": 0,
                  "maximum": 9007199254740991
                },
                "title": {
                  "type": "string",
                  "minLength": 1
                },
                "description": {
                  "type": "string",
                  "minLength": 1
                },
                "emphasis": {
                  "type": "array",
                  "items": {
                    "type": "string"
                  }
                }
              },
              "required": ["time", "seconds", "title", "description"],
              "additionalProperties": false
            }
          }
        },
        "required": ["title", "points"],
        "additionalProperties": false
      }
    },
    "conclusion": {
      "type": "string",
      "minLength": 1
    },
    "footerText": {
      "type": "string"
    },
    "generation": {
      "type": "object",
      "properties": {
        "transcriptFile": {
          "type": "string"
        },
        "createdAt": {
          "type": "string",
          "format": "date-time",
          "pattern": "^(?:(?:\\d\\d[2468][048]|\\d\\d[13579][26]|\\d\\d0[48]|[02468][048]00|[13579][26]00)-02-29|\\d{4}-(?:(?:0[13578]|1[02])-(?:0[1-9]|[12]\\d|3[01])|(?:0[469]|11)-(?:0[1-9]|[12]\\d|30)|(?:02)-(?:0[1-9]|1\\d|2[0-8])))T(?:(?:[01]\\d|2[0-3]):[0-5]\\d:[0-5]\\d(?:\\.\\d+)?(?:Z|([+-](?:[01]\\d|2[0-3]):[0-5]\\d)))$"
        },
        "notes": {
          "type": "string"
        }
      },
      "additionalProperties": false
    }
  },
  "required": [
    "schemaVersion",
    "video",
    "abstract",
    "mainTakeaway",
    "highlights",
    "sections",
    "conclusion"
  ],
  "additionalProperties": false,
  "title": "YouTube Video Recap Data",
  "description": "Generated from apps/api/src/schemas/recaps.ts by `npm run schema:generate`. Do not edit by hand."
}
